{"compatibility":{"requiredCapabilities":["multi-file-reading","structured-reasoning"],"testedEnvironments":[]},"files":[{"path":"README.md","sha256":"4caa148a55dde65ec3fe755cf3cc7936315da662f7e344110cc1d2b05cf46b91","size":1119},{"path":"documentation/checklist-qualite.md","sha256":"38a67bbd41cdfbd1343dccf017d25ae23f7ea1ef2995079c568ba1f3359d8404","size":492},{"path":"instructions/role-architecte.md","sha256":"67a005b0a0eb93a12485046ab9cde47f67232d7e89bdae771f9f7333af7753f3","size":1099},{"path":"rules/securite-perimetre.md","sha256":"25a01ece47275e8390ad8407bb629d07de5e8cc220d1d26f54f53b5fafe04aed","size":773},{"path":"workflows/cadrage-projet.md","sha256":"644621881ecb977718e90576944d4882c328f23144a58aad9b10ea828163a3f4","size":735}],"license":{"id":"previsualisation-privee-interne","version":"0.1.0"},"manifestVersion":"1.0.0","module":{"category":"developpement-logiciel","entrypoint":"README.md","id":"promptube-software-architect","language":"fr","name":"Promptube — Architecte de projet logiciel","slug":"architecte-projet-logiciel","subcategory":"ingenierie-logicielle-assistee-par-ia","version":"1.0.0-alpha.1"}}
