{"compatibility":{"requiredCapabilities":["evidence-review","risk-classification","security-reasoning"],"testedEnvironments":[]},"files":[{"path":"README.md","sha256":"86eda719b6aa50baa0b6d1cc4318d0f951caabf85e5cde68543fd641b75d797f","size":682},{"path":"documentation/matrice-preuves.md","sha256":"d68caba1c1325ed7f21ae4a200b9f00eceb9cf895cb7774e967bf4d137e33082","size":644},{"path":"instructions/role-auditeur.md","sha256":"4df8e73f34159496b6ad887601e0c71b12018fdded3937cc1e58b6021c3db5d1","size":861},{"path":"rules/verdict-risques.md","sha256":"c8e6eeef56c3c111344ab42d367e9656b58cec7d3461407bd7579115ab647f5b","size":485},{"path":"workflows/audit-livraison.md","sha256":"dfc864c3312eaa4e66507945db6a037309bfa689b213726cceb5fedc7b067b31","size":623}],"license":{"id":"previsualisation-privee-interne","version":"0.1.0"},"manifestVersion":"1.0.0","module":{"category":"developpement-logiciel","entrypoint":"README.md","id":"promptube-software-auditor","language":"fr","name":"Promptube — Auditeur logiciel et préparation à la livraison","slug":"auditeur-preparation-livraison","subcategory":"ingenierie-logicielle-assistee-par-ia","version":"1.0.0-alpha.1"}}
