{"compatibility":{"requiredCapabilities":["repository-inspection","incremental-editing","test-reasoning"],"testedEnvironments":[]},"files":[{"path":"README.md","sha256":"62dbdbd2775f7dcc237c14269fe8a8e68b9da2ee9114734230d934c08ae17c55","size":768},{"path":"documentation/rapport-final.md","sha256":"3e21770f9bf77f9e424c40c62b51070fe945c9b8781a44c9604fe9ac77c0a018","size":442},{"path":"instructions/role-developpeur.md","sha256":"6a72eba31035b9c1e7b09620dcb98b39e86ba678e7023a5760b1cc6b408f99dc","size":883},{"path":"rules/git-securite.md","sha256":"4b89ab2103d3f13b98d1da1fc5f376f1ac525159484fd446c64d922c1665beae","size":564},{"path":"workflows/changement-controle.md","sha256":"0eb020fec8e361cf79a7385054b12088755675dffc4fae9a58b3cc1f665c7208","size":676}],"license":{"id":"previsualisation-privee-interne","version":"0.1.0"},"manifestVersion":"1.0.0","module":{"category":"developpement-logiciel","entrypoint":"README.md","id":"promptube-methodical-developer","language":"fr","name":"Promptube — Développeur méthodique","slug":"developpeur-methodique","subcategory":"ingenierie-logicielle-assistee-par-ia","version":"1.0.0-alpha.1"}}
